{
  "$schema": "https://json-schema.org/draft/2020-12/schema",
  "$id": "https://github.com/ibrahim7860/Gemma-Guardian/shared/schemas/v1/command_translations_envelope.json",
  "title": "EGS → Bridge command_translation envelope",
  "description": "EGS Gemma 4 E4B output for an operator_command. Bridge subscribes to egs.command_translations and forwards to WS clients as type=command_translation. The if/then constraints enforce that valid=false iff command=unknown_command.",
  "type": "object",
  "required": ["kind", "command_id", "structured", "valid", "preview_text", "preview_text_in_operator_language", "egs_published_at_iso_ms", "contract_version"],
  "additionalProperties": false,
  "properties": {
    "kind": {"const": "command_translation"},
    "command_id": {"$ref": "_common.json#/$defs/command_id"},
    "structured": {"$ref": "operator_commands.json"},
    "valid": {"type": "boolean"},
    "preview_text": {"type": "string", "minLength": 1, "maxLength": 1024},
    "preview_text_in_operator_language": {"type": "string", "minLength": 1, "maxLength": 1024},
    "egs_published_at_iso_ms": {"$ref": "_common.json#/$defs/iso_timestamp_utc_ms"},
    "contract_version": {"type": "string", "pattern": "^\\d+\\.\\d+\\.\\d+$"}
  },
  "allOf": [
    {
      "if": {"properties": {"valid": {"const": false}}, "required": ["valid"]},
      "then": {"properties": {"structured": {"properties": {"command": {"const": "unknown_command"}}}}}
    },
    {
      "if": {"properties": {"structured": {"properties": {"command": {"const": "unknown_command"}}}}, "required": ["structured"]},
      "then": {"properties": {"valid": {"const": false}}}
    }
  ]
}
